{
  "server": "srv1900820",
  "capturedAt": "2026-08-24T12:14:41Z",
  "parser": "vps-dump",
  "parserVersion": "2.0.0",
  "record": {
    "name": "srv1900820",
    "ip": "200.234.35.172",
    "state": {
      "diskAvail": "185G",
      "diskTotal": "193G",
      "diskUsed": "8.3G",
      "diskUsedPct": 5,
      "firewall": "active",
      "firewallDefault": "deny (incoming), allow (outgoing), deny (routed)",
      "firewallRules": [
        "22/tcp (OpenSSH) ALLOW IN Anywhere",
        "80 ALLOW IN Anywhere",
        "443 ALLOW IN Anywhere",
        "22/tcp ALLOW IN Anywhere",
        "Anywhere DENY IN 27.79.41.230"
      ],
      "kernel": "6.8.0-137-generic",
      "kernelInstalled": [
        "6.8.0-137-generic",
        "6.8.0-138-generic"
      ],
      "load": [
        0.07,
        0.19,
        0.24
      ],
      "memAvailable": "12Gi",
      "memTotal": "15Gi",
      "memUsed": "3.1Gi",
      "memUsedPct": 21,
      "mounts": [
        {
          "avail": "185G",
          "fs": "/dev/sda1",
          "mount": "/",
          "size": "193G",
          "usePct": 5,
          "used": "8.3G"
        },
        {
          "avail": "704M",
          "fs": "/dev/sda16",
          "mount": "/boot",
          "size": "881M",
          "usePct": 15,
          "used": "116M"
        },
        {
          "avail": "99M",
          "fs": "/dev/sda15",
          "mount": "/boot/efi",
          "size": "105M",
          "usePct": 6,
          "used": "6.2M"
        }
      ],
      "os": "Ubuntu 24.04.4 LTS",
      "rebootPending": true,
      "swapTotal": "0B",
      "swapUsed": "0B",
      "uptime": "11 days",
      "uptimeSeconds": 960660
    },
    "specs": {
      "arch": "x86-64",
      "cpu": 4,
      "cpuModel": "AMD EPYC 9355P 32-Core Processor",
      "disk": "193G",
      "diskBytes": 207232172032,
      "ram": "15Gi",
      "ramBytes": 16106127360,
      "virt": "kvm"
    },
    "containers": [
      {
        "name": "kwdelhi6-web-1",
        "status": "Up 47 hours",
        "state": "running",
        "ageDays": 1,
        "createdAt": "2026-08-22 12:56:06 +0000 UTC",
        "image": "kwdelhi6-web",
        "ports": "127.0.0.1:8082->8000/tcp"
      },
      {
        "name": "kwgroup-app-1",
        "status": "Up 6 days",
        "state": "running",
        "ageDays": 6,
        "createdAt": "2026-08-18 05:13:12 +0000 UTC",
        "image": "kwgroup-app",
        "ports": "3000/tcp"
      },
      {
        "name": "kw-blue-pearl-web-1",
        "status": "Up 6 days",
        "state": "running",
        "ageDays": 6,
        "createdAt": "2026-08-18 04:24:20 +0000 UTC",
        "image": "kw-blue-pearl-web",
        "ports": "127.0.0.1:8081->3000/tcp"
      },
      {
        "name": "kw-blue-pearl-db-1",
        "status": "Up 10 days (healthy)",
        "state": "running",
        "ageDays": 10,
        "createdAt": "2026-08-14 06:29:26 +0000 UTC",
        "image": "postgres:16-alpine",
        "ports": "5432/tcp"
      },
      {
        "name": "kwdelhi6-db-1",
        "status": "Up 10 days (healthy)",
        "state": "running",
        "ageDays": 10,
        "createdAt": "2026-08-13 12:48:26 +0000 UTC",
        "image": "postgres:16-alpine",
        "ports": "5432/tcp"
      },
      {
        "name": "kwgroup-web-1",
        "status": "Up 6 days",
        "state": "running",
        "ageDays": 11,
        "createdAt": "2026-08-13 10:37:07 +0000 UTC",
        "image": "nginx:1.27-alpine",
        "ports": "127.0.0.1:8080->80/tcp"
      },
      {
        "name": "kwgroup-db-1",
        "status": "Up 11 days (healthy)",
        "state": "running",
        "ageDays": 11,
        "createdAt": "2026-08-13 10:37:07 +0000 UTC",
        "image": "postgres:16-alpine",
        "ports": "5432/tcp"
      }
    ],
    "cron": [
      {
        "source": "crontab",
        "cmd": "/opt/kw-blue-pearl/deploy/autopull.sh >> /var/log/kw-blue-pearl-deploy.log 2>&1",
        "hasSecret": false,
        "schedule": "*/2 * * * *",
        "user": "root"
      },
      {
        "source": "crontab",
        "cmd": "/opt/kwdelhi6/deploy/autopull.sh >> /var/log/kwdelhi6-deploy.log 2>&1",
        "hasSecret": false,
        "schedule": "*/2 * * * *",
        "user": "root"
      },
      {
        "source": "cron.d",
        "cmd": "test -x /usr/bin/certbot -a \\! -d /run/systemd/system && perl -e 'sleep int(rand(43200))' && certbot -q renew --no-random-sleep-on-renew",
        "hasSecret": false,
        "schedule": "0 */12 * * *",
        "user": "root"
      },
      {
        "source": "cron.d",
        "cmd": "docker builder prune -f > /dev/null 2>&1",
        "hasSecret": false,
        "schedule": "20 0 * * 5",
        "user": "root"
      },
      {
        "source": "cron.d",
        "cmd": "docker image prune -af --filter \"until=24h\" > /dev/null 2>&1",
        "hasSecret": false,
        "schedule": "34 1 * * *",
        "user": "root"
      },
      {
        "source": "cron.d",
        "cmd": "test -e /run/systemd/system || SERVICE_MODE=1 /usr/lib/x86_64-linux-gnu/e2fsprogs/e2scrub_all_cron",
        "hasSecret": false,
        "schedule": "30 3 * * 0",
        "user": "root"
      },
      {
        "source": "cron.d",
        "cmd": "test -e /run/systemd/system || SERVICE_MODE=1 /sbin/e2scrub_all -A -r",
        "hasSecret": false,
        "schedule": "10 3 * * *",
        "user": "root"
      },
      {
        "source": "cron.d",
        "cmd": "apt-get update -qq && apt-get install -y -qq monarx-agent monarx-protect monarx-protect-autodetect > /dev/null 2>&1",
        "hasSecret": false,
        "schedule": "51 8 * * 1",
        "user": "root"
      },
      {
        "source": "cron.d",
        "cmd": "command -v debian-sa1 > /dev/null && debian-sa1 1 1",
        "hasSecret": false,
        "schedule": "5-55/10 * * * *",
        "user": "root"
      },
      {
        "source": "cron.d",
        "cmd": "command -v debian-sa1 > /dev/null && debian-sa1 60 2",
        "hasSecret": false,
        "schedule": "59 23 * * *",
        "user": "root"
      },
      {
        "source": "systemd-timer",
        "cmd": "sysstat-collect.service",
        "hasSecret": false,
        "schedule": "next: Mon 2026-08-24 12:20:00 UTC",
        "unit": "sysstat-collect.timer"
      },
      {
        "source": "systemd-timer",
        "cmd": "certbot.service",
        "hasSecret": false,
        "schedule": "next: Mon 2026-08-24 12:33:48 UTC",
        "unit": "certbot.timer"
      },
      {
        "source": "systemd-timer",
        "cmd": "dpkg-db-backup.service",
        "hasSecret": false,
        "schedule": "next: Tue 2026-08-25 00:00:00 UTC",
        "unit": "dpkg-db-backup.timer"
      },
      {
        "source": "systemd-timer",
        "cmd": "logrotate.service",
        "hasSecret": false,
        "schedule": "next: Tue 2026-08-25 00:00:00 UTC",
        "unit": "logrotate.timer"
      },
      {
        "source": "systemd-timer",
        "cmd": "sysstat-summary.service",
        "hasSecret": false,
        "schedule": "next: Tue 2026-08-25 00:07:00 UTC",
        "unit": "sysstat-summary.timer"
      },
      {
        "source": "systemd-timer",
        "cmd": "apt-daily.service",
        "hasSecret": false,
        "schedule": "next: Tue 2026-08-25 03:27:22 UTC",
        "unit": "apt-daily.timer"
      },
      {
        "source": "systemd-timer",
        "cmd": "man-db.service",
        "hasSecret": false,
        "schedule": "next: Tue 2026-08-25 04:57:43 UTC",
        "unit": "man-db.timer"
      },
      {
        "source": "systemd-timer",
        "cmd": "apt-daily-upgrade.service",
        "hasSecret": false,
        "schedule": "next: Tue 2026-08-25 06:28:33 UTC",
        "unit": "apt-daily-upgrade.timer"
      },
      {
        "source": "systemd-timer",
        "cmd": "update-notifier-download.service",
        "hasSecret": false,
        "schedule": "next: Tue 2026-08-25 09:31:23 UTC",
        "unit": "update-notifier-download.timer"
      },
      {
        "source": "systemd-timer",
        "cmd": "systemd-tmpfiles-clean.service",
        "hasSecret": false,
        "schedule": "next: Tue 2026-08-25 09:40:47 UTC",
        "unit": "systemd-tmpfiles-clean.timer"
      },
      {
        "source": "systemd-timer",
        "cmd": "update-notifier-motd.service",
        "hasSecret": false,
        "schedule": "next: Fri 2026-08-28 07:18:44 UTC 3 days Thu 2026-08-20 06:46:53 UTC",
        "unit": "update-notifier-motd.timer"
      },
      {
        "source": "systemd-timer",
        "cmd": "e2scrub_all.service",
        "hasSecret": false,
        "schedule": "next: Sun 2026-08-30 03:10:35 UTC 5 days Sun 2026-08-23 03:11:01 UTC 1 day 9h ago e2scrub_all.timer",
        "unit": "e2scrub_all.timer"
      },
      {
        "source": "systemd-timer",
        "cmd": "fstrim.service",
        "hasSecret": false,
        "schedule": "next: Mon 2026-08-31 00:39:43 UTC 6 days Mon 2026-08-24 00:03:57 UTC",
        "unit": "fstrim.timer"
      }
    ],
    "databaseEngines": {
      "mariadb": "absent",
      "mongod": "absent",
      "mysql": "absent",
      "postgresql": "absent",
      "redis-server": "absent"
    },
    "docker": {
      "compose": [
        {
          "name": "kw-blue-pearl",
          "status": "running(2)",
          "configFile": "/opt/kw-blue-pearl/docker-compose.yml"
        },
        {
          "name": "kwdelhi6",
          "status": "running(2)",
          "configFile": "/opt/kwdelhi6/docker-compose.yml"
        },
        {
          "name": "kwgroup",
          "status": "running(3)",
          "configFile": "/var/www/kwgroup/docker-compose.yml"
        }
      ],
      "containersRunning": 7,
      "containersTotal": 7,
      "diskUsage": {
        "buildCache": "755.4MB",
        "containers": "294.5MB",
        "images": "2.17GB",
        "reclaimable": "0B",
        "volumes": "146MB"
      },
      "images": 5,
      "version": "29.7.2",
      "volumes": 5
    },